{
  "schema_version": 1,
  "receipt_type": "local_controlled_module_write_lease",
  "trust_mode": "local_controlled_same_user",
  "security_caveat": "same_os_user_can_access_private_key_not_host_native_attestation",
  "explicit_user_authorization": true,
  "authorization_mode": "local-controlled-same-user",
  "authorization_source": "{{EXTERNAL_USER_AUTHORIZATION_ID}}",
  "issuer": "{{EXTERNAL_LOCAL_SIGNER_ID}}",
  "key_id": "{{EXTERNAL_KEY_ID}}",
  "key_fingerprint_sha256": "{{PINNED_RAW_ED25519_PUBLIC_KEY_SHA256}}",
  "registry_path": "{{EXACT_CANONICAL_ABSOLUTE_EXTERNAL_REGISTRY_PATH}}",
  "project_root": "{{ABSOLUTE_PROJECT_ROOT}}",
  "module_key": "{{REGISTERED_MODULE_KEY}}",
  "stable_title": "{{REGISTERED_STABLE_TITLE}}",
  "agent_handle": "{{AUTHORIZED_AGENT_HANDLE}}",
  "run_id": "{{AUTHORIZED_RUN_ID}}",
  "assigned_model": "gpt-5.6-sol",
  "assigned_reasoning_effort": "medium",
  "role": "implementation",
  "authorized_actions": ["write_module_artifacts"],
  "owned_paths": ["{{EXACT_PROJECT_RELATIVE_OWNED_PATH}}"],
  "targets": [{"path": "{{EXACT_PROJECT_RELATIVE_TARGET}}", "pre_sha256": "{{TARGET_PRE_SHA256}}", "pre_size": 0, "post_sha256": "{{TARGET_POST_SHA256}}", "post_size": 0}],
  "baseline_path": "docs/requirements/video-cropping-baseline.md",
  "baseline_sha256": "{{BASELINE_SHA256}}",
  "policy_sha256": "{{AGENTS_RAW_SHA256}}",
  "authority_matrix_sha256": "{{CANONICAL_AUTHORITY_MATRIX_SHA256}}",
  "base_candidate_sha256": "{{BASE_CANDIDATE_SHA256}}",
  "post_candidate_sha256": "{{POST_CANDIDATE_SHA256}}",
  "code_version": "{{CODE_VERSION}}",
  "build_id": "{{BUILD_ID}}",
  "issued_at": "{{UTC_ISSUED_AT}}",
  "not_before": "{{UTC_NOT_BEFORE}}",
  "expires_at": "{{UTC_EXPIRES_AT_MAX_15_MINUTES}}",
  "ttl_seconds": 900,
  "nonce": "{{UNIQUE_SHA256_NONCE}}",
  "receipt_id": "{{UNIQUE_RECEIPT_ID}}",
  "lease_id": "{{UNIQUE_LEASE_ID}}"
}
